{"admission_id":"ce23d7d35166fcd4a2d4e2d9c01e6d820ec79d87b55662498b5d7d52f2cc9f9f","protocol_version":"domains.admission.v0.1","reasons":[],"schema_version":1,"selection_basis":"source documentation, metadata identities and budget; no prediction scores","specification":{"budget":{"estimated_peak_memory_bytes":838860800,"estimated_seconds":300,"evidence_upper_bytes":2097152,"model_fits_upper":324,"policy_sha256":"18d38e575859faeb95c6533be577063d005b0039179b951e287bef6f12626f64","scratch_upper_bytes":50331648},"catalog_revision":"e68d1befb6cb8245799e83d4b4e4c41e66287689","content_version":"original-2024-alpha11-keyed-v1","dataset_id":"ecosis_intact_and_ground_leaf_litter_spectra_from_cedar_creek_reflectance_nirs","dependencies":{"audit":{"axis_sha256":"70fe4261c5f43c9a039d4350c7c4ce85675b85a048de4d6b17ebacec3c3cd9de","extra_ground_keys":[],"limits":["GEN collection-period provenance is incomplete; all GEN observations stay one conservative block.","MPLS trees share one residential-site block. Numeric plots are experimental units, not independent source studies.","Logical assay ownership is keyed; assay batch/event IDs and precision are unavailable."],"missing_ground_keys":["GEN_1_BEPA_7"],"n_declared_plot_contexts":31,"n_development":298,"n_ground":321,"n_intact":322,"n_paired":321,"n_retained":24,"n_transfer_development":297,"paired_reference_exact":true,"retained_groups":["106","22","4","53","69","7","87"],"test_target_accessed":false},"rule":"whole original plot; GEN and MPLS conservative contexts, plus original individual and reference links"},"factors":{"plot":"original metadata_fields plot definition","species":"original species code"},"identities":{"original_sample_keys":{"evidence":["Original ID equals plot_individual_species_number, unique in each source."],"status":"verified"},"reference_scope":"logical original sample/Nmass; shared laboratory batch precision unknown","source_reference_alignment":{"evidence":["Spectra, source ID and Nmass share one original keyed CSV record; no standardized Y.csv used."],"status":"verified"}},"independent_units":31,"missing_fields":["assay events and precision","GEN collection provenance","independent source-population replicates"],"permissions":{"access":{"evidence":["Official EcoSIS cc-by license, package metadata pinned in original acquisition.","Attribution: Shan Kothari, Sarah Hobbie, Jeannine Cavender-Bares; Intact- and ground-leaf litter spectra from Cedar Creek and Minneapolis."],"status":"allowed"},"local_analysis":{"evidence":["Official EcoSIS cc-by license, package metadata pinned in original acquisition.","Attribution: Shan Kothari, Sarah Hobbie, Jeannine Cavender-Bares; Intact- and ground-leaf litter spectra from Cedar Creek and Minneapolis."],"status":"allowed"},"publish_statistics":{"evidence":["Official EcoSIS cc-by license, package metadata pinned in original acquisition.","Attribution: Shan Kothari, Sarah Hobbie, Jeannine Cavender-Bares; Intact- and ground-leaf litter spectra from Cedar Creek and Minneapolis."],"status":"allowed"},"redistribute_raw":{"evidence":["Official EcoSIS cc-by license, package metadata pinned in original acquisition.","Attribution: Shan Kothari, Sarah Hobbie, Jeannine Cavender-Bares; Intact- and ground-leaf litter spectra from Cedar Creek and Minneapolis."],"status":"allowed"}},"representation":"singleton source-averaged intact spectrum, complete 2001-band axis","review_evidence":["Original open package and metadata definitions; independent litter material/study versus Perten and CA2023.","Paired missing key inventoried before scores; all 322 intact observations retained."],"scientific_reference":["https://data.ecosis.org/dataset/85ca4a2e-0a61-4ef7-9e0f-ffa6ea1c2c22","10.5061/dryad.hdr7sqvrk"],"source_hashes":{"ground_spec.csv":"4a265130aa42082d45e5b90fd2ced9794cd98f46f984f9e978896d76dedcbb49","intact_spec.csv":"8e245d0cd2a1a92ecf605cdf3674170d187e29b5d01c92b426ed6553bf6d7d4a","metadata_fields.csv":"5bf0adf2fc1c1bd09efbd34828ec746a74004acbd801e53a33df3df6d48aacec"},"source_id":"intact","split":{"memberships":[{"component":"litter:plot:101","id":"litter:101_1C_PIBA_1","partition":"train"},{"component":"litter:plot:101","id":"litter:101_1C_PIBA_2","partition":"train"},{"component":"litter:plot:101","id":"litter:101_4C_PIBA_1","partition":"train"},{"component":"litter:plot:106","id":"litter:106_1D_QUEL_1","partition":"test"},{"component":"litter:plot:106","id":"litter:106_1D_QUEL_2","partition":"test"},{"component":"litter:plot:106","id":"litter:106_3G_QUEL_1","partition":"test"},{"component":"litter:plot:12","id":"litter:12_6D_ACRU_1","partition":"train"},{"component":"litter:plot:136","id":"litter:136_3C_QUAL_1","partition":"train"},{"component":"litter:plot:136","id":"litter:136_3C_QUAL_2","partition":"train"},{"component":"litter:plot:136","id":"litter:136_4C_QUAL_1","partition":"train"},{"component":"litter:plot:136","id":"litter:136_4C_QUAL_2","partition":"train"},{"component":"litter:plot:136","id":"litter:136_7D_QUAL_1","partition":"train"},{"component":"litter:plot:136","id":"litter:136_7D_QUAL_2","partition":"train"},{"component":"litter:plot:141","id":"litter:141_1_ACNE_1","partition":"train"},{"component":"litter:plot:141","id":"litter:141_2_ACNE_1","partition":"train"},{"component":"litter:plot:141","id":"litter:141_3_ACNE_1","partition":"train"},{"component":"litter:plot:144","id":"litter:144_2B_QURU_1","partition":"train"},{"component":"litter:plot:144","id":"litter:144_2D_QURU_1","partition":"train"},{"component":"litter:plot:144","id":"litter:144_4C_QURU_1","partition":"train"},{"component":"litter:plot:144","id":"litter:144_4C_QURU_2","partition":"train"},{"component":"litter:plot:144","id":"litter:144_4H_QURU_1","partition":"train"},{"component":"litter:plot:144","id":"litter:144_7F_QURU_1","partition":"train"},{"component":"litter:plot:144","id":"litter:144_7F_QURU_2","partition":"train"},{"component":"litter:plot:146","id":"litter:146_6A_PIRE_1","partition":"train"},{"component":"litter:plot:146","id":"litter:146_6A_PIRE_2","partition":"train"},{"component":"litter:plot:146","id":"litter:146_6A_PIRE_3","partition":"train"},{"component":"litter:plot:147","id":"litter:147_2A_ACRU_1","partition":"train"},{"component":"litter:plot:147","id":"litter:147_2A_ACRU_2","partition":"train"},{"component":"litter:plot:147","id":"litter:147_6F_ACRU_1","partition":"train"},{"component":"litter:plot:147","id":"litter:147_6F_ACRU_2","partition":"train"},{"component":"litter:plot:22","id":"litter:22_1B_QUAL_1","partition":"test"},{"component":"litter:plot:22","id":"litter:22_2C_QUAL_1","partition":"test"},{"component":"litter:plot:22","id":"litter:22_4F_QUAL_1","partition":"test"},{"component":"litter:plot:22","id":"litter:22_8C_QUAL_1","partition":"test"},{"component":"litter:plot:22","id":"litter:22_8C_QUAL_2","partition":"test"},{"component":"litter:plot:36","id":"litter:36_1C_PIRE_1","partition":"train"},{"component":"litter:plot:36","id":"litter:36_1C_PIRE_2","partition":"train"},{"component":"litter:plot:36","id":"litter:36_1C_PIRE_3","partition":"train"},{"component":"litter:plot:36","id":"litter:36_2B_PIRE_1","partition":"train"},{"component":"litter:plot:36","id":"litter:36_2B_PIRE_2","partition":"train"},{"component":"litter:plot:36","id":"litter:36_2B_PIRE_3","partition":"train"},{"component":"litter:plot:36","id":"litter:36_2B_PIRE_4","partition":"train"},{"component":"litter:plot:36","id":"litter:36_5C_PIRE_1","partition":"train"},{"component":"litter:plot:36","id":"litter:36_5C_PIRE_2","partition":"train"},{"component":"litter:plot:36","id":"litter:36_5C_PIRE_3","partition":"train"},{"component":"litter:plot:36","id":"litter:36_6B_PIRE_1","partition":"train"},{"component":"litter:plot:36","id":"litter:36_6B_PIRE_2","partition":"train"},{"component":"litter:plot:36","id":"litter:36_6B_PIRE_3","partition":"train"},{"component":"litter:plot:41","id":"litter:41_6H_PIRE_1","partition":"train"},{"component":"litter:plot:41","id":"litter:41_6H_PIRE_2","partition":"train"},{"component":"litter:plot:41","id":"litter:41_6H_PIRE_3","partition":"train"},{"component":"litter:plot:42","id":"litter:42_4H_BEPA_1","partition":"train"},{"component":"litter:plot:44","id":"litter:44_8H_PIBA_1","partition":"train"},{"component":"litter:plot:44","id":"litter:44_8H_PIBA_2","partition":"train"},{"component":"litter:plot:45","id":"litter:45_2A_QUEL_1","partition":"train"},{"component":"litter:plot:45","id":"litter:45_4F_QUEL_1","partition":"train"},{"component":"litter:plot:45","id":"litter:45_7H_QUEL_1","partition":"train"},{"component":"litter:plot:49","id":"litter:49_1G_PIRE_1","partition":"train"},{"component":"litter:plot:49","id":"litter:49_1G_PIRE_2","partition":"train"},{"component":"litter:plot:49","id":"litter:49_1G_PIRE_3","partition":"train"},{"component":"litter:plot:49","id":"litter:49_1G_PIRE_4","partition":"train"},{"component":"litter:plot:4","id":"litter:4_1H_PIST_1","partition":"test"},{"component":"litter:plot:4","id":"litter:4_1H_PIST_2","partition":"test"},{"component":"litter:plot:51","id":"litter:51_4E_QUMA_1","partition":"train"},{"component":"litter:plot:51","id":"litter:51_4E_QUMA_2","partition":"train"},{"component":"litter:plot:51","id":"litter:51_4F_QUMA_1","partition":"train"},{"component":"litter:plot:51","id":"litter:51_4F_QUMA_2","partition":"train"},{"component":"litter:plot:51","id":"litter:51_8C_QUMA_1","partition":"train"},{"component":"litter:plot:52","id":"litter:52_1D_PIST_1","partition":"train"},{"component":"litter:plot:52","id":"litter:52_1D_PIST_2","partition":"train"},{"component":"litter:plot:52","id":"litter:52_2G_PIST_1","partition":"train"},{"component":"litter:plot:52","id":"litter:52_2G_PIST_2","partition":"train"},{"component":"litter:plot:53","id":"litter:53_1B_PIBA_1","partition":"test"},{"component":"litter:plot:53","id":"litter:53_1B_PIBA_2","partition":"test"},{"component":"litter:plot:53","id":"litter:53_1B_PIBA_3","partition":"test"},{"component":"litter:plot:53","id":"litter:5